{
  "$schema": "schema/source-manifest.schema.json",
  "schema_version": 1,
  "retrieval_date": "2026-09-04",
  "policy": {
    "canonical": false,
    "purpose": [
      "verify extraction coverage",
      "compare level counts",
      "detect probable extraction errors",
      "identify records requiring review"
    ],
    "prohibited_uses": [
      "overwriting authoritative records",
      "using English definitions as lexical identity",
      "silently resolving discrepancies"
    ]
  },
  "sources": [
    {
      "id": "unige-hsk-2015",
      "name": "University of Geneva HSK vocabulary transcription",
      "dataset": "hsk_2015_exam",
      "provider": "University of Geneva, Confucius Institute",
      "repository_url": null,
      "landing_url": "https://www.unige.ch/ic/hsk/vocabulaire",
      "claimed_edition": "Hanban 新汉语水平考试大纲 1-6级, People's Education Press, 2015",
      "last_update": "unknown (landing page retrieved 2026-09-04)",
      "revision": {
        "type": "http_artifact_sha256",
        "value": "cdbe9588241fda5931ae2137e79326addc370bd2bbe90bd73a3b7970c6f954c4"
      },
      "license": {
        "spdx": null,
        "name": "No explicit reuse license located",
        "url": "https://www.unige.ch/ic/hsk/vocabulaire",
        "redistribution": "unknown; do not commit the PDF without permission"
      },
      "derivation": {
        "method": "University-maintained annotated transcription",
        "upstream_authoritative_url": "https://admin.chinesetest.cn/godownload.do",
        "same_authoritative_source": true,
        "independence_class": "separately maintained same-edition transcription",
        "limitations": "Contains annotations and implicit/recomposed vocabulary; it is not assumed to be row-for-row equivalent to the CTI workbook. No direct adapter is supplied for its table-heavy PDF."
      },
      "expected": {
        "source_records": null,
        "classification_assignments": null,
        "counts_by_level": null
      },
      "artifacts": [
        {
          "url": "https://www.unige.ch/ic/application/files/7915/4272/2792/HSK_VOCABULARY_.pdf",
          "repository_path": null,
          "sha256": "cdbe9588241fda5931ae2137e79326addc370bd2bbe90bd73a3b7970c6f954c4",
          "format": "pdf",
          "adapter": null
        }
      ]
    },
    {
      "id": "shawkynasr-gf0025-2021",
      "name": "HSK official Query System vocabulary export",
      "dataset": "proficiency_standard_2021",
      "provider": "shawkynasr",
      "repository_url": "https://github.com/shawkynasr/HSK-official-Query-System",
      "landing_url": "https://github.com/shawkynasr/HSK-official-Query-System",
      "claimed_edition": "GF0025-2021 / New HSK Levels 2021",
      "last_update": "2026-08-21T12:47:59+03:00",
      "revision": {
        "type": "git_commit",
        "value": "11694d519638a4f9e50d5fd7dc6b87d140d8752e"
      },
      "license": {
        "spdx": "MIT",
        "name": "MIT License",
        "url": "https://github.com/shawkynasr/HSK-official-Query-System/blob/11694d519638a4f9e50d5fd7dc6b87d140d8752e/LICENSE",
        "redistribution": "permitted with copyright and license notice"
      },
      "derivation": {
        "method": "Export/transcription of the former official ChineseTest query system; README says typos were corrected",
        "upstream_authoritative_url": "https://www.moe.gov.cn/jyb_sjzl/ziliao/A19/202111/t20211118_580755.html",
        "same_authoritative_source": true,
        "independence_class": "separately maintained official-query export",
        "limitations": "Maintenance corrections mean differences must be adjudicated against the MOE document, not accepted automatically."
      },
      "expected": {
        "source_records": 11092,
        "classification_assignments": 11092,
        "counts_by_level": {"1": 500, "2": 772, "3": 973, "4": 1000, "5": 1071, "6": 1140, "7-9": 5636}
      },
      "artifacts": [
        {
          "url": "https://raw.githubusercontent.com/shawkynasr/HSK-official-Query-System/11694d519638a4f9e50d5fd7dc6b87d140d8752e/%E8%AF%8D%E6%B1%87.csv",
          "repository_path": "词汇.csv",
          "sha256": "f79d832ffe2a4015d5a24d6aa9c6f734e90053a02456fa0fc37eeefb65c630cc",
          "format": "csv",
          "adapter": "shawkynasr-2021-csv"
        }
      ]
    },
    {
      "id": "krmanik-gf0025-2021",
      "name": "krmanik HSK 2021 OCR word lists",
      "dataset": "proficiency_standard_2021",
      "provider": "krmanik",
      "repository_url": "https://github.com/krmanik/HSK-3.0",
      "landing_url": "https://github.com/krmanik/HSK-3.0/tree/182692ce5a11bc30bdc771835d2f0f27491c25de/New%20HSK%20%282021%29/HSK%20List",
      "claimed_edition": "GF0025-2021 vocabulary list",
      "last_update": "2026-06-14T17:26:05+08:00",
      "revision": {
        "type": "git_commit",
        "value": "182692ce5a11bc30bdc771835d2f0f27491c25de"
      },
      "license": {
        "spdx": "CC-BY-SA-4.0",
        "name": "CC BY-SA 4.0 for HSK word lists",
        "url": "https://github.com/krmanik/HSK-3.0/blob/182692ce5a11bc30bdc771835d2f0f27491c25de/License.md",
        "redistribution": "permitted subject to attribution and share-alike; references only are committed here"
      },
      "derivation": {
        "method": "OCR of the MOE PDF, published as one headword-only file per level",
        "upstream_authoritative_url": "https://www.moe.gov.cn/jyb_xwfb/gzdt_gzdt/s5987/202103/W020210329527301787356.pdf",
        "same_authoritative_source": true,
        "independence_class": "independent OCR of same document",
        "limitations": "Contains 11,091 headword rows rather than 11,092 and no pinyin. It can establish headword coverage candidates, never strict lexical matches."
      },
      "expected": {
        "source_records": 11091,
        "classification_assignments": 11091,
        "counts_by_level": {"1": 500, "2": 771, "3": 973, "4": 1000, "5": 1071, "6": 1140, "7-9": 5636}
      },
      "artifacts": [
        {"url": "https://raw.githubusercontent.com/krmanik/HSK-3.0/182692ce5a11bc30bdc771835d2f0f27491c25de/New%20HSK%20%282021%29/HSK%20List/HSK%201.txt", "repository_path": "New HSK (2021)/HSK List/HSK 1.txt", "sha256": "3081701aee20cec7b8d8c8f3f5041b667d5ed37810f1f750a708eeafbaa572a1", "format": "text-lines", "adapter": "krmanik-headword-directory"},
        {"url": "https://raw.githubusercontent.com/krmanik/HSK-3.0/182692ce5a11bc30bdc771835d2f0f27491c25de/New%20HSK%20%282021%29/HSK%20List/HSK%202.txt", "repository_path": "New HSK (2021)/HSK List/HSK 2.txt", "sha256": "1e9150bd38b18d5ec602d7d9d898c16bd28bfba6a3d4c358b04a3238364a44c7", "format": "text-lines", "adapter": "krmanik-headword-directory"},
        {"url": "https://raw.githubusercontent.com/krmanik/HSK-3.0/182692ce5a11bc30bdc771835d2f0f27491c25de/New%20HSK%20%282021%29/HSK%20List/HSK%203.txt", "repository_path": "New HSK (2021)/HSK List/HSK 3.txt", "sha256": "9ccd47f23f8f84d73c84608edfce75d81dee71480244d8929e102ef74e960c8a", "format": "text-lines", "adapter": "krmanik-headword-directory"},
        {"url": "https://raw.githubusercontent.com/krmanik/HSK-3.0/182692ce5a11bc30bdc771835d2f0f27491c25de/New%20HSK%20%282021%29/HSK%20List/HSK%204.txt", "repository_path": "New HSK (2021)/HSK List/HSK 4.txt", "sha256": "a1f458ff843a6a39541901046c1508f2ca1443626fc9a3f3cc3c8157672a4bed", "format": "text-lines", "adapter": "krmanik-headword-directory"},
        {"url": "https://raw.githubusercontent.com/krmanik/HSK-3.0/182692ce5a11bc30bdc771835d2f0f27491c25de/New%20HSK%20%282021%29/HSK%20List/HSK%205.txt", "repository_path": "New HSK (2021)/HSK List/HSK 5.txt", "sha256": "051d6e691add4a86b8bf91e42490ddb3b775e74bfd15463845cb10b1d6610dc1", "format": "text-lines", "adapter": "krmanik-headword-directory"},
        {"url": "https://raw.githubusercontent.com/krmanik/HSK-3.0/182692ce5a11bc30bdc771835d2f0f27491c25de/New%20HSK%20%282021%29/HSK%20List/HSK%206.txt", "repository_path": "New HSK (2021)/HSK List/HSK 6.txt", "sha256": "1a81273a1ae95f41f8a39fcf8fdd1d59ca9cdf7e810894be6dce195670a8b9b8", "format": "text-lines", "adapter": "krmanik-headword-directory"},
        {"url": "https://raw.githubusercontent.com/krmanik/HSK-3.0/182692ce5a11bc30bdc771835d2f0f27491c25de/New%20HSK%20%282021%29/HSK%20List/HSK%207-9.txt", "repository_path": "New HSK (2021)/HSK List/HSK 7-9.txt", "sha256": "6d344f9ce169e677a49d1bbb6b8c2c34590863347d2156c85efad9f28f6dc84e", "format": "text-lines", "adapter": "krmanik-headword-directory"}
      ]
    },
    {
      "id": "zispace-gf0025-row-candidates",
      "name": "zispace GF0025 level-ordered vocabulary transcription",
      "dataset": "proficiency_standard_2021",
      "provider": "zispace",
      "repository_url": "https://github.com/zispace/hanyu-hsk",
      "landing_url": "https://github.com/zispace/hanyu-hsk/blob/ca0a5662a95ecc8522983d24bfbef5ab5b8cda0a/data/GF%200025-2021/%E5%9B%BD%E9%99%85%E4%B8%AD%E6%96%87%E6%95%99%E8%82%B2%E4%B8%AD%E6%96%87%E6%B0%B4%E5%B9%B3%E7%AD%89%E7%BA%A7%E6%A0%87%E5%87%86-%E8%AF%8D%E6%B1%87%E8%A1%A8.txt",
      "claimed_edition": "GF0025-2021 vocabulary list",
      "last_update": "2026-03-20T17:34:50+08:00",
      "revision": {
        "type": "git_commit",
        "value": "ca0a5662a95ecc8522983d24bfbef5ab5b8cda0a"
      },
      "license": {
        "spdx": null,
        "name": "No explicit repository license located",
        "url": "https://github.com/zispace/hanyu-hsk/tree/ca0a5662a95ecc8522983d24bfbef5ab5b8cda0a",
        "redistribution": "not vendored; obtain the pinned revision for local reproduction"
      },
      "derivation": {
        "method": "Level-ordered transcription citing the MOE PDF and shawkynasr export",
        "upstream_authoritative_url": "https://www.moe.gov.cn/jyb_xwfb/gzdt_gzdt/s5987/202103/W020210329527301787356.pdf",
        "same_authoritative_source": true,
        "independence_class": "non-authoritative row-candidate scaffold",